<?xml version="1.0"?>
<!--
/**
 * Magento
 *
 * NOTICE OF LICENSE
 *
 * This source file is subject to the Academic Free License (AFL 3.0)
 * that is bundled with this package in the file LICENSE_AFL.txt.
 * It is also available through the world-wide-web at this URL:
 * http://opensource.org/licenses/afl-3.0.php
 * If you did not receive a copy of the license and are unable to
 * obtain it through the world-wide-web, please send an email
 * to license@magentocommerce.com so we can send you a copy immediately.
 *
 * DISCLAIMER
 *
 * Do not edit or add to this file if you wish to upgrade Magento to newer
 * versions in the future. If you wish to customize Magento for your
 * needs please refer to http://www.magentocommerce.com for more information.
 *
 * @copyright   Copyright (c) 2014 X.commerce, Inc. (http://www.magentocommerce.com)
 * @license     http://opensource.org/licenses/afl-3.0.php  Academic Free License (AFL 3.0)
 */
-->
<config xmlns:xsi="http://www.w3.org/2001/XMLSchema-instance" xsi:noNamespaceSchemaLocation="../../../../../../lib/internal/Magento/Framework/Event/etc/events.xsd">
    <event name="sales_order_item_save_commit_after">
        <observer name="downloadable_observer" instance="Magento\Downloadable\Model\Observer" method="saveDownloadableOrderItem" />
    </event>
    <event name="sales_order_save_commit_after">
        <observer name="downloadable_observer" instance="Magento\Downloadable\Model\Observer" method="setLinkStatus" />
    </event>
    <event name="checkout_type_onepage_save_order_after">
        <observer name="checkout_type_onepage_save_order_after" instance="Magento\Downloadable\Model\Observer" method="setHasDownloadableProducts" />
    </event>
    <event name="checkout_type_multishipping_create_orders_single">
        <observer name="checkout_type_multishipping_create_orders_single" instance="Magento\Downloadable\Model\Observer" method="setHasDownloadableProducts" />
    </event>
    <event name="checkout_allow_guest">
        <observer name="checkout_allow_guest" instance="Magento\Downloadable\Model\Observer" method="isAllowedGuestCheckout" />
    </event>
    <event name="product_option_renderer_init">
        <observer name="downloadable_observer" instance="Magento\Downloadable\Model\Observer" method="initOptionRenderer" />
    </event>
</config>
