<?xml version="1.0"?>
<!--
/**
 * Magento
 *
 * NOTICE OF LICENSE
 *
 * This source file is subject to the Academic Free License (AFL 3.0)
 * that is bundled with this package in the file LICENSE_AFL.txt.
 * It is also available through the world-wide-web at this URL:
 * http://opensource.org/licenses/afl-3.0.php
 * If you did not receive a copy of the license and are unable to
 * obtain it through the world-wide-web, please send an email
 * to license@magentocommerce.com so we can send you a copy immediately.
 *
 * DISCLAIMER
 *
 * Do not edit or add to this file if you wish to upgrade Magento to newer
 * versions in the future. If you wish to customize Magento for your
 * needs please refer to http://www.magentocommerce.com for more information.
 *
 * @copyright   Copyright (c) 2014 X.commerce, Inc. (http://www.magentocommerce.com)
 * @license     http://opensource.org/licenses/afl-3.0.php  Academic Free License (AFL 3.0)
 */
-->
<config xmlns:xsi="http://www.w3.org/2001/XMLSchema-instance" xsi:noNamespaceSchemaLocation="../../../../../../lib/internal/Magento/Framework/Event/etc/events.xsd">
    <event name="catalog_product_delete_before">
        <observer name="sales_quote_observer" instance="Magento\Sales\Model\Observer\Backend\CatalogProductQuote" method="subtractQtyFromQuotes" />
    </event>
    <event name="catalogrule_before_apply">
        <observer name="sales_quote_observer" instance="Magento\Sales\Model\Observer\Backend\CatalogPriceRule" method="dispatch" />
    </event>
    <event name="catalogrule_after_apply">
        <observer name="sales_quote_observer" instance="Magento\Sales\Model\Observer\Backend\CatalogPriceRule" method="dispatch" />
    </event>
    <event name="catalog_product_save_after">
        <observer name="sales_quote" instance="Magento\Sales\Model\Observer\Backend\CatalogProductQuote" method="catalogProductSaveAfter" />
    </event>
    <event name="catalog_product_status_update">
        <observer name="sales_quote" instance="Magento\Sales\Model\Observer\Backend\CatalogProductQuote" method="catalogProductStatusUpdate" />
    </event>
    <event name="customer_save_after_data_object">
        <observer name="customer" instance="Magento\Sales\Model\Observer\Backend\CustomerQuote" method="dispatch" />
    </event>
</config>
