<?xml version="1.0"?>
<!--
/**
 * Magento
 *
 * NOTICE OF LICENSE
 *
 * This source file is subject to the Academic Free License (AFL 3.0)
 * that is bundled with this package in the file LICENSE_AFL.txt.
 * It is also available through the world-wide-web at this URL:
 * http://opensource.org/licenses/afl-3.0.php
 * If you did not receive a copy of the license and are unable to
 * obtain it through the world-wide-web, please send an email
 * to license@magentocommerce.com so we can send you a copy immediately.
 *
 * DISCLAIMER
 *
 * Do not edit or add to this file if you wish to upgrade Magento to newer
 * versions in the future. If you wish to customize Magento for your
 * needs please refer to http://www.magentocommerce.com for more information.
 *
 * @copyright   Copyright (c) 2014 X.commerce, Inc. (http://www.magentocommerce.com)
 * @license     http://opensource.org/licenses/afl-3.0.php  Academic Free License (AFL 3.0)
 */
-->
<config xmlns:xsi="http://www.w3.org/2001/XMLSchema-instance" xsi:noNamespaceSchemaLocation="../../../../../lib/internal/Magento/Framework/Event/etc/events.xsd">
    <event name="catalog_block_product_status_display">
        <observer name="inventory" instance="Magento\CatalogInventory\Model\Observer" method="displayProductStatusInfo" />
    </event>
    <event name="catalog_product_load_after">
        <observer name="inventory" instance="Magento\CatalogInventory\Model\Observer" method="addInventoryData" />
    </event>
    <event name="catalog_product_collection_load_after">
        <observer name="inventory" instance="Magento\CatalogInventory\Model\Observer" method="addStockStatusToCollection" />
    </event>
    <event name="sales_quote_item_collection_products_after_load">
        <observer name="inventory" instance="Magento\CatalogInventory\Model\Observer" method="addInventoryDataToCollection" />
    </event>
    <event name="sales_quote_item_qty_set_after">
        <observer name="inventory" instance="Magento\CatalogInventory\Model\Quote\Item\QuantityValidator" method="validate" />
    </event>
    <event name="checkout_submit_all_after">
        <observer name="inventory" instance="Magento\CatalogInventory\Model\Observer" method="checkoutAllSubmitAfter" />
    </event>
    <event name="sales_model_service_quote_submit_before">
        <observer name="inventory" instance="Magento\CatalogInventory\Model\Observer" method="subtractQuoteInventory" />
    </event>
    <event name="sales_model_service_quote_submit_success">
        <observer name="inventory" instance="Magento\CatalogInventory\Model\Observer" method="reindexQuoteInventory" />
    </event>
    <event name="sales_model_service_quote_submit_failure">
        <observer name="inventory" instance="Magento\CatalogInventory\Model\Observer" method="revertQuoteInventory" />
    </event>
    <event name="restore_quote">
        <observer name="inventory" instance="Magento\CatalogInventory\Model\Observer" method="revertQuoteInventory" />
    </event>
    <event name="sales_order_item_cancel">
        <observer name="inventory" instance="Magento\CatalogInventory\Model\Observer" method="cancelOrderItem" />
    </event>
    <event name="sales_order_creditmemo_save_after">
        <observer name="inventory" instance="Magento\CatalogInventory\Model\Observer" method="refundOrderInventory" />
    </event>
    <event name="catalog_product_save_after">
        <observer name="inventory" instance="Magento\CatalogInventory\Model\Observer" method="saveInventoryData" />
    </event>
    <event name="admin_system_config_changed_section_cataloginventory">
        <observer name="inventory" instance="Magento\CatalogInventory\Model\Observer" method="updateItemsStockUponConfigChange" />
    </event>
</config>
