<?xml version="1.0"?>
<!--
/**
 * Magento
 *
 * NOTICE OF LICENSE
 *
 * This source file is subject to the Academic Free License (AFL 3.0)
 * that is bundled with this package in the file LICENSE_AFL.txt.
 * It is also available through the world-wide-web at this URL:
 * http://opensource.org/licenses/afl-3.0.php
 * If you did not receive a copy of the license and are unable to
 * obtain it through the world-wide-web, please send an email
 * to license@magentocommerce.com so we can send you a copy immediately.
 *
 * DISCLAIMER
 *
 * Do not edit or add to this file if you wish to upgrade Magento to newer
 * versions in the future. If you wish to customize Magento for your
 * needs please refer to http://www.magentocommerce.com for more information.
 *
 * @copyright   Copyright (c) 2014 X.commerce, Inc. (http://www.magentocommerce.com)
 * @license     http://opensource.org/licenses/afl-3.0.php  Academic Free License (AFL 3.0)
 */
-->
<config xmlns:xsi="http://www.w3.org/2001/XMLSchema-instance" xsi:noNamespaceSchemaLocation="../../../../../../lib/internal/Magento/Framework/Event/etc/events.xsd">
    <event name="customer_data_object_login">
        <observer name="persistent" instance="Magento\Persistent\Model\Observer\Session" method="synchronizePersistentOnLogin" />
    </event>
    <event name="customer_logout">
        <observer name="persistent" instance="Magento\Persistent\Model\Observer\Session" method="synchronizePersistentOnLogout" />
    </event>
    <event name="controller_front_send_response_after">
        <observer name="persistent" instance="Magento\Persistent\Model\Observer\Session" method="synchronizePersistentInfo" />
    </event>
    <event name="controller_action_predispatch_customer_account_loginPost">
        <observer name="persistent" instance="Magento\Persistent\Model\Observer\Session" method="setRememberMeCheckedStatus" />
    </event>
    <event name="controller_action_predispatch_customer_account_createpost">
        <observer name="persistent" instance="Magento\Persistent\Model\Observer\Session" method="setRememberMeCheckedStatus" />
        <observer name="persistent_authenticate" instance="Magento\Persistent\Model\Observer\CustomerAuthenticatedEvent" method="execute" />
    </event>
    <event name="controller_action_postdispatch_checkout_onepage_saveBilling">
        <observer name="persistent" instance="Magento\Persistent\Model\Observer\Session" method="setRememberMeCheckedStatus" />
    </event>
    <event name="controller_action_layout_generate_blocks_after">
        <observer name="persistent" instance="Magento\Persistent\Model\Observer\ApplyPersistentData" method="execute" />
    </event>
    <event name="controller_action_predispatch">
        <observer name="persistent" instance="Magento\Persistent\Model\Observer\EmulateQuote" method="execute" />
        <observer name="persistent_session" instance="Magento\Persistent\Model\Observer\Session" method="renewCookie" />
        <observer name="persistent_quote" instance="Magento\Persistent\Model\Observer\CheckExpirePersistentQuote" method="execute" />
        <observer name="persistent_customer" instance="Magento\Persistent\Model\Observer\EmulateCustomer" method="execute" />
        <observer name="persistent_checkout" instance="Magento\Persistent\Model\Observer\PreventExpressCheckout" method="execute" />
    </event>
    <event name="checkout_allow_guest">
        <observer name="persistent" instance="Magento\Persistent\Model\Observer\DisableGuestCheckout" method="execute" />
    </event>
    <event name="customer_customer_authenticated">
        <observer name="persistent" instance="Magento\Persistent\Model\Observer\CustomerAuthenticatedEvent" method="execute" />
    </event>
    <event name="controller_action_predispatch_persistent_index_unsetCookie">
        <observer name="persistent" instance="Magento\Persistent\Model\Observer\PreventClearCheckoutSession" method="execute" />
    </event>
    <event name="controller_action_postdispatch_persistent_index_unsetCookie">
        <observer name="persistent" instance="Magento\Persistent\Model\Observer\MakePersistentQuoteGuest" method="execute" />
    </event>
    <event name="sales_quote_save_before">
        <observer name="persistent" instance="Magento\Persistent\Model\Observer\SetQuotePersistentData" method="execute" />
    </event>
    <event name="custom_quote_process">
        <observer name="persistent" instance="Magento\Persistent\Model\Observer\SetLoadPersistentQuote" method="execute" />
    </event>
    <event name="customer_register_success">
        <observer name="persistent" instance="Magento\Persistent\Model\Observer\RemovePersistentCookie" method="execute" />
    </event>
    <event name="render_block">
        <observer name="persistent" instance="Magento\Persistent\Model\Observer\ApplyBlockPersistentData" method="execute" />
    </event>
    <event name="update_customer_cookies">
        <observer name="persistent" instance="Magento\Persistent\Model\Observer\UpdateCustomerCookies" method="execute" />
    </event>
</config>
